{
  "contract_version": "1",
  "type": "meeting_snapshot",
  "event_id": "00000000-0000-4000-8000-000000000014",
  "meeting_id": "aaaaaaaa-aaaa-4aaa-8aaa-aaaaaaaaaaaa",
  "occurred_at": "2026-08-26T08:00:00Z",
  "payload": {
    "meeting": {
      "id": "aaaaaaaa-aaaa-4aaa-8aaa-aaaaaaaaaaaa",
      "title": "实时转录联调",
      "status": "recording",
      "language": "Chinese",
      "started_at": "2026-08-26T07:58:00Z",
      "ended_at": null,
      "transcript_revision": 3,
      "content_revision": 3,
      "interruption_reason": null,
      "created_at": "2026-08-26T07:58:00Z"
    },
    "health": {
      "storage": "ok",
      "transcription": "ok",
      "mic_muted": false,
      "recovery_journal_active": false
    },
    "partial": {
      "text": "正在确认",
      "speaker_key": "e1:s1",
      "speaker_name": "说话人 1"
    },
    "transcript_revision": 3,
    "content_revision": 3
  }
}
