{
  "contract_version": "1",
  "type": "transcript_reconciled",
  "event_id": "00000000-0000-4000-8000-000000000006",
  "meeting_id": "aaaaaaaa-aaaa-4aaa-8aaa-aaaaaaaaaaaa",
  "occurred_at": "2026-08-21T10:02:00Z",
  "payload": {
    "transcript_revision": 3,
    "content_revision": 3,
    "replace_from_ms": 0,
    "segments": [{
      "id": "11111111-1111-4111-8111-111111111111",
      "order": 0,
      "speaker_key": "e1:s1",
      "speaker_name": "说话人 1",
      "start_ms": 1000,
      "end_ms": 2000,
      "text": "确认发布。",
      "translation": null,
      "detected_language": "zh",
      "source_epoch": 1
    }]
  }
}
