{
  "contract_version": "1",
  "type": "meeting_state_changed",
  "event_id": "00000000-0000-4000-8000-000000000005",
  "meeting_id": "aaaaaaaa-aaaa-4aaa-8aaa-aaaaaaaaaaaa",
  "occurred_at": "2026-08-21T11:06:00Z",
  "payload": {"status": "interrupted", "started_at": "2026-08-21T10:01:00Z", "ended_at": "2026-08-21T11:06:00Z", "interruption_reason": "transcription_gap"}
}
