{
  "contract_version": "1",
  "type": "minutes_state_changed",
  "event_id": "00000000-0000-4000-8000-000000000009",
  "meeting_id": "aaaaaaaa-aaaa-4aaa-8aaa-aaaaaaaaaaaa",
  "occurred_at": "2026-08-21T11:06:30Z",
  "payload": {
    "minutes_id": "22222222-2222-4222-8222-222222222222",
    "version": 1,
    "status": "completed",
    "error_code": null,
    "error_message": null,
    "minutes": {
      "id": "22222222-2222-4222-8222-222222222222",
      "meeting_id": "aaaaaaaa-aaaa-4aaa-8aaa-aaaaaaaaaaaa",
      "version": 1,
      "status": "completed",
      "source_content_revision": 3,
      "model": "local/kat-coder-2.5",
      "prompt_version": "v1",
      "content_json": {"overview": "确认发布计划。", "topics": [], "decisions": [], "action_items": [], "risks": [], "open_questions": [], "highlights": []},
      "content_markdown": "# 会议纪要\n\n## 概要\n\n确认发布计划。\n",
      "raw_output": null,
      "error_code": null,
      "error_message": null,
      "created_at": "2026-08-21T11:06:00Z",
      "is_stale": false
    }
  }
}
